Symbol,Name,Last Sale,Net Change,% Change,Market Cap,Country,IPO Year,Volume,Sector,Industry
REKR,Rekor Systems Inc. Common Stock,$1.74,0.08,4.819%,148523358.00,United States,,1426528,Telecommunications,Telecommunications Equipment
RELI,Reliance Global Group Inc. Common Stock,$3.79,-0.11,-2.821%,3490590.00,United States,,310356,Finance,Specialty Insurers
RELIW,Reliance Global Group Inc. Series A Warrants,$0.0563,0.0143,34.048%,51852.00,United States,,6221,Finance,Specialty Insurers
RELL,Richardson Electronics Ltd. Common Stock,$11.63,-0.02,-0.172%,166058269.00,United States,1983,86893,Technology,Electronic Components
RELY,Remitly Global Inc. Common Stock,$12.83,0.38,3.052%,2469526444.00,United States,2021,2296849,Consumer Discretionary,Business Services
RENB,Renovaro Inc. Common Stock,$1.60,0.02,1.266%,236007910.00,United States,,664870,Health Care,Biotechnology: Pharmaceutical Preparations
RENE,Cartesian Growth Corporation II Class A Ordinary Shares,$11.28,0.00,0.00%,0.00,United States,2022,65,Finance,Blank Checks
RENT,Rent the Runway Inc. Class A Common Stock,$15.08,0.35,2.376%,56124352.00,United States,2021,49235,Consumer Discretionary,Other Specialty Stores
REPL,Replimune Group Inc. Common Stock,$8.11,0.02,0.247%,498076502.00,United States,2018,336031,Health Care,Biotechnology: Biological Products (No Diagnostic Substances)
RETO,ReTo Eco-Solutions Inc. Common Shares,$1.775,-0.145,-7.552%,6647710.00,China,2017,258764,Industrials,Industrial Machinery/Components
REVB,Revelation Biosciences Inc. Common Stock,$1.73,-0.0308,-1.749%,2824978.00,United States,2020,34387,Health Care,Biotechnology: Pharmaceutical Preparations
REVBW,Revelation Biosciences Inc. Warrant,$0.0163,-0.0008,-4.678%,26617.00,United States,2020,2793,Health Care,Biotechnology: Pharmaceutical Preparations
REYN,Reynolds Consumer Products Inc. Common Stock,$27.49,0.04,0.146%,5776688259.00,United States,2020,627928,Consumer Discretionary,Containers/Packaging
RFAC,RF Acquisition Corp. Class A Common Stock,$11.09,0.00,0.00%,0.00,Singapore,2022,7322,Finance,Blank Checks
RFAI,RF Acquisition Corp II Ordinary Shares,$10.04,10.04,,,Singapore,,1175843,,
RFAIR,RF Acquisition Corp II Right,$0.085,0.085,,0.00,Singapore,,1309316,,
RFAIU,RF Acquisition Corp II Unit,$10.12,0.04,0.397%,0.00,Singapore,2024,221893,Finance,Blank Checks
RFIL,RF Industries Ltd. Common Stock,$3.86,0.16,4.324%,40512815.00,United States,,34488,Technology,Electrical Products
RGC,Regencell Bioscience Holdings Limited Ordinary Shares,$3.63,0.42,13.084%,47236704.00,Hong Kong,2021,6083,Health Care, Medicinal Chemicals and Botanical Products 
RGCO,RGC Resources Inc. Common Stock,$19.33,-0.22,-1.125%,196800856.00,United States,,23476,Utilities,Oil & Gas Production
RGEN,Repligen Corporation Common Stock,$120.08,-0.69,-0.571%,6709577352.00,United States,1986,577569,Health Care,Biotechnology: Biological Products (No Diagnostic Substances)
RGF,The Real Good Food Company Inc. Class A Common Stock,$0.544,0.0273,5.284%,18324207.00,United States,2021,76160,Consumer Staples,Packaged Foods
RGLD,Royal Gold Inc. Common Stock,$131.00,1.97,1.527%,8611031122.00,United States,,184679,Industrials,Precious Metals
RGLS,Regulus Therapeutics Inc. Common Stock,$1.66,-0.14,-7.778%,108673354.00,United States,2012,684502,Health Care,Biotechnology: Pharmaceutical Preparations
RGNX,REGENXBIO Inc. Common Stock,$10.90,0.08,0.739%,536890029.00,United States,2015,417514,Health Care,Biotechnology: Biological Products (No Diagnostic Substances)
RGP,Resources Connection Inc. Common Stock,$10.23,-0.32,-3.033%,345850306.00,United States,,491397,Consumer Discretionary,Business Services
RGS,Regis Corporation Common Stock,$23.00,1.70,7.981%,52438804.00,United States,1991,187967,Consumer Discretionary,Other Consumer Services
RGTI,Rigetti Computing Inc. Common Stock,$0.992,0.032,3.333%,170543942.00,United States,,3064850,Technology,EDP Services
RGTIW,Rigetti Computing Inc. Warrants,$0.1483,0.0083,5.929%,25495632.00,United States,,3373,Technology,EDP Services
RICK,RCI Hospitality Holdings Inc. Common Stock,$39.71,-0.41,-1.022%,370300396.00,United States,1995,189016,Consumer Discretionary,Restaurants
RIGL,Rigel Pharmaceuticals Inc. Common Stock,$7.78,0.05,0.647%,136603527.00,United States,2000,543447,Health Care,Biotechnology: Pharmaceutical Preparations
RILY,B. Riley Financial Inc. Common Stock,$15.05,-1.92,-11.314%,455944310.00,United States,,1696431,Finance,Investment Managers
RILYG,B. Riley Financial Inc. 5.00% Senior Notes due 2026,$17.60,-0.28,-1.566%,533197333.00,United States,,9728,Finance,Investment Managers
RILYK,B. Riley Financial Inc. 5.50% Senior Notes Due 2026,$20.83,-0.42,-1.976%,631051161.00,United States,,16403,Finance,Investment Managers
RILYL,B. Riley Financial Inc. Depositary Shares each representing 1/1000th in a share of 7.375% Series B Cumulative Perpetual Preferred Stock par value $0.0001,$21.88,-0.655,-2.907%,662861230.00,United States,,6294,Finance,Investment Managers
RILYM,B. Riley Financial Inc. 6.375% Senior Notes due 2025,$24.36,-0.09,-0.368%,737993581.00,United States,,8176,Finance,Investment Managers
RILYN,B. Riley Financial Inc. 6.50% Senior Notes Due 2026,$18.84,-0.37,-1.926%,570763509.00,United States,,50822,Finance,Investment Managers
RILYP,B. Riley Financial Inc. Depositary Shares each representing a 1/1000th fractional interest in a share of Series A Cumulative Perpetual Preferred Stock,$18.30,-0.22,-1.188%,554404045.00,United States,,12236,Finance,Investment Managers
RILYT,B. Riley Financial Inc. 6.00% Senior Notes Due 2028,$16.5355,-0.6245,-3.639%,500947983.00,United States,,65944,Finance,Investment Managers
RILYZ,B. Riley Financial Inc. 5.25% Senior Notes due 2028,$14.44,-0.77,-5.062%,437464175.00,United States,,97990,Finance,Investment Managers
RIOT,Riot Platforms Inc. Common Stock ,$9.64,0.07,0.731%,2783886879.00,United States,,19623672,Finance,Finance: Consumer Services
RIVN,Rivian Automotive Inc. Class A Common Stock,$14.79,0.14,0.956%,14720786231.00,United States,2021,36970791,Consumer Discretionary,Auto Manufacturing
RKDA,Arcadia Biosciences Inc. Common Stock,$3.0194,0.0194,0.647%,4114959.00,United States,2015,6420,Consumer Staples,Farming/Seeds/Milling
RKLB,Rocket Lab USA Inc. Common Stock,$4.88,0.26,5.628%,2404765014.00,United States,2020,4660011,Industrials,Military/Government/Technical
RLAY,Relay Therapeutics Inc. Common Stock,$6.36,0.09,1.435%,844237066.00,United States,2020,600803,Health Care,Biotechnology: Biological Products (No Diagnostic Substances)
RLMD,Relmada Therapeutics Inc. Common Stock,$3.02,0.01,0.332%,91126090.00,United States,,97954,Health Care,Biotechnology: Pharmaceutical Preparations
RLYB,Rallybio Corporation Common Stock,$1.33,0.05,3.906%,55127565.00,United States,2021,119674,Health Care,Biotechnology: Pharmaceutical Preparations
RMBI,Richmond Mutual Bancorporation Inc. Common Stock,$11.65,-0.03,-0.257%,128912597.00,United States,2019,2061,Finance,Major Banks
RMBL,RumbleOn Inc. Class B Common Stock,$3.78,-0.10,-2.577%,133272367.00,United States,,251987,Technology,EDP Services
RMBS,Rambus Inc. Common Stock,$61.95,1.44,2.38%,6677017091.00,United States,1997,929091,Technology,Semiconductors
RMCF,Rocky Mountain Chocolate Factory Inc. Common Stock,$2.05,0.03,1.485%,12981637.00,United States,,32357,Consumer Staples,Specialty Foods
RMCO,Royalty Management Holding Corporation Class A Common Stock,$0.778,-0.0008,-0.103%,11642066.00,United States,2023,48897,Miscellaneous,Multi-Sector Companies
RMNI,Rimini Street Inc. (DE) Common Stock,$2.78,-0.09,-3.136%,251339800.00,United States,2015,320671,Consumer Discretionary,Business Services
RMR,The RMR Group Inc. Class A Common Stock,$22.67,-0.03,-0.132%,719333359.00,United States,,102599,Consumer Discretionary,Professional Services
RMTI,Rockwell Medical Inc. Common Stock,$1.72,-0.048,-2.715%,52142976.00,United States,1998,119242,Health Care,Biotechnology: Pharmaceutical Preparations
RNA,Avidity Biosciences Inc. Common Stock,$39.00,1.79,4.811%,3729833172.00,United States,2020,1013495,Health Care,Biotechnology: Pharmaceutical Preparations
RNAC,Cartesian Therapeutics Inc. Common Stock,$16.97,-0.65,-3.689%,301999019.00,United States,2016,394689,Health Care,Biotechnology: Pharmaceutical Preparations
RNAZ,TransCode Therapeutics Inc. Common Stock,$0.7601,-0.108,-12.441%,5033422.00,United States,2021,417430,Health Care,Biotechnology: Pharmaceutical Preparations
RNLX,Renalytix plc American Depositary Shares,$0.2571,0.0072,2.881%,19844031.00,United Kingdom,2020,355897,Health Care,Medical Specialities
RNW,ReNew Energy Global plc Class A Ordinary Shares,$5.98,-0.08,-1.32%,481745631.00,United Kingdom,,531706,Utilities,Electric Utilities: Central
RNWWW,ReNew Energy Global plc Warrant,$0.4998,0.0747,17.572%,40263623.00,United Kingdom,,301,Utilities,Electric Utilities: Central
RNXT,RenovoRx Inc. Common Stock,$1.135,0.015,1.339%,27185321.00,United States,2021,20131,Health Care,Biotechnology: Pharmaceutical Preparations
ROAD,Construction Partners Inc. Class A Common Stock,$53.99,-0.36,-0.662%,2852149490.00,United States,2018,249868,Industrials,Military/Government/Technical
ROCK,Gibraltar Industries Inc. Common Stock,$67.50,-0.89,-1.301%,2056706708.00,United States,1993,109614,Industrials,Steel/Iron Ore
ROCL,Roth CH Acquisition V Co. Common Stock,$10.94,0.00,0.00%,0.00,United States,2022,74,Finance,Blank Checks
ROCLU,Roth CH Acquisition V Co. Unit,$11.50,-0.49,-4.087%,0.00,United States,2021,999,Finance,Blank Checks
ROCLW,Roth CH Acquisition V Co. Warrant,$0.0605,0.0026,4.491%,0.00,United States,2022,2500,Finance,Blank Checks
ROIC,Retail Opportunity Investments Corp. Common Stock (MD),$12.44,0.01,0.08%,1585532164.00,United States,,504428,Real Estate,Real Estate Investment Trusts
ROIV,Roivant Sciences Ltd. Common Shares,$10.65,0.17,1.622%,7867387245.00,United Kingdom,,4281693,Health Care,Biotechnology: Pharmaceutical Preparations
ROKU,Roku Inc. Class A Common Stock,$62.08,-0.21,-0.337%,8949742465.00,United States,2017,2912965,Telecommunications,Cable & Other Pay Television Services
ROMA,Roma Green Finance Limited Ordinary Shares,$0.575,0.002,0.349%,5994542.00,Hong Kong,2024,48382,Consumer Discretionary,Professional Services
ROOT,Root Inc. Class A Common Stock,$55.64,1.17,2.148%,829036000.00,United States,2020,266902,Finance,Property-Casualty Insurers
ROP,Roper Technologies Inc. Common Stock,$562.56,2.11,0.376%,60218971922.00,United States,1992,324764,Industrials,Industrial Machinery/Components
ROST,Ross Stores Inc. Common Stock,$145.55,1.55,1.076%,48551827568.00,United States,1985,1601693,Consumer Discretionary,Clothing/Shoe/Accessory Stores
RPAY,Repay Holdings Corporation Class A Common Stock,$9.62,0.20,2.123%,921461714.00,United States,2018,1817105,Consumer Discretionary,Business Services
RPD,Rapid7 Inc. Common Stock,$41.95,-0.01,-0.024%,2614514747.00,United States,2015,446974,Technology,Computer Software: Prepackaged Software
RPHM,Reneo Pharmaceuticals Inc. Common Stock,$1.50,-0.01,-0.662%,50131212.00,United States,2021,262196,Health Care,Biotechnology: Pharmaceutical Preparations
RPID,Rapid Micro Biosystems Inc. Class A Common Stock,$0.648,0.045,7.463%,27774457.00,United States,2021,10795,Industrials,Biotechnology: Laboratory Analytical Instruments
RPRX,Royalty Pharma plc Class A Ordinary Shares ,$25.67,-0.25,-0.965%,15336214747.00,United States,2020,5297999,Health Care,Biotechnology: Pharmaceutical Preparations
RPTX,Repare Therapeutics Inc. Common Shares,$3.17,-0.01,-0.314%,134551937.00,Canada,2020,47956,Health Care,Biotechnology: Pharmaceutical Preparations
RR,Richtech Robotics Inc. Class B Common Stock,$1.32,0.07,5.60%,0.00,United States,2023,94481,Industrials,Industrial Machinery/Components
RRBI,Red River Bancshares Inc. Common Stock,$46.23,-1.40,-2.939%,319132532.00,United States,2019,10589,Consumer Discretionary,Hotels/Resorts
RRGB,Red Robin Gourmet Burgers Inc. Common Stock,$6.60,0.03,0.457%,103382400.00,United States,2002,213127,Consumer Discretionary,Restaurants
RRR,Red Rock Resorts Inc. Class A Common Stock,$54.27,0.06,0.111%,5730705611.00,United States,2016,236146,Consumer Discretionary,Hotels/Resorts
RSLS,ReShape Lifesciences Inc. Common Stock,$0.2062,-0.0195,-8.64%,4836852.00,United States,2016,862370,Health Care,Medical/Dental Instruments
RSSS,Research Solutions Inc Common Stock,$2.55,0.05,2.00%,82319199.00,United States,,10292,Consumer Discretionary,Business Services
RSVR,Reservoir Media Inc. Common Stock,$7.43,-0.09,-1.197%,482207104.00,United States,2021,13879,Consumer Discretionary,Services-Misc. Amusement & Recreation
RSVRW,Reservoir Media Inc. Warrant,$0.8401,-0.0099,-1.165%,54522502.00,United States,2021,100,Consumer Discretionary,Services-Misc. Amusement & Recreation
RTC,Baijiayun Group Ltd. Class A Ordinary Shares,$5.40,1.00,22.727%,94708132.00,China,2006,85651,Technology,Computer Software: Prepackaged Software
RUM,Rumble Inc. Class A Common Stock,$5.58,-0.17,-2.957%,2164326072.00,United States,2021,656718,Technology,Computer Software: Programming Data Processing
RUMBW,Rumble Inc. Warrant,$0.98,-0.11,-10.092%,380114615.00,United States,2021,11519,Technology,Computer Software: Programming Data Processing
RUN,Sunrun Inc. Common Stock,$12.21,0.05,0.411%,2706504131.00,United States,2015,12172408,Miscellaneous,Industrial Machinery/Components
RUSHA,Rush Enterprises Inc. Common Stock Cl A,$41.17,-0.66,-1.578%,3236544885.00,United States,,183993,Consumer Discretionary,Retail-Auto Dealers and Gas Stations
RUSHB,Rush Enterprises Inc. Class B,$38.84,-0.56,-1.421%,3053373897.00,United States,,10311,Consumer Discretionary,Retail-Auto Dealers and Gas Stations
RVMD,Revolution Medicines Inc. Common Stock,$37.53,0.61,1.652%,6191933099.00,United States,2020,609776,Health Care,Biotechnology: Biological Products (No Diagnostic Substances)
RVMDW,Revolution Medicines Inc. Warrant,$0.124,0.00,0.00%,20458292.00,United States,,12,,
RVNC,Revance Therapeutics Inc. Common Stock,$2.67,-0.01,-0.373%,278877500.00,United States,2014,1097976,Health Care,Biotechnology: Pharmaceutical Preparations
RVPH,Reviva Pharmaceuticals Holdings Inc. Common Stock ,$1.17,0.10,9.346%,32664715.00,United States,2020,370097,Health Care,Biotechnology: Pharmaceutical Preparations
RVPHW,Reviva Pharmaceuticals Holdings Inc. Warrants,$0.2842,0.0067,2.414%,7934455.00,United States,2018,21866,Health Care,Biotechnology: Pharmaceutical Preparations
RVSB,Riverview Bancorp Inc Common Stock,$3.80,-0.13,-3.308%,80221963.00,United States,,212115,Finance,Savings Institutions
RVSN,Rail Vision Ltd. Ordinary Share,$0.6921,0.0421,6.477%,2075108.00,Israel,2022,946814,Industrials,Railroads
RVSNW,Rail Vision Ltd. Warrant,$0.0711,-0.0043,-5.703%,213178.00,Israel,2022,2500,Industrials,Railroads
RVYL,Ryvyl Inc. Common Stock,$1.74,0.26,17.568%,11256655.00,United States,,62958,Consumer Discretionary,Professional Services
RWAY,Runway Growth Finance Corp. Common Stock,$11.71,0.01,0.085%,461824367.00,United States,2021,249433,Finance,Finance: Consumer Services
RWAYL,Runway Growth Finance Corp. 7.50% Notes due 2027,$25.07,0.042,0.168%,988722192.00,United States,,1124,Finance,Finance: Consumer Services
RWAYZ,Runway Growth Finance Corp. 8.00% Notes due 2027,$25.22,-0.01,-0.04%,994637961.00,United States,,2902,Finance,Finance: Consumer Services
RXRX,Recursion Pharmaceuticals Inc. Class A Common Stock,$7.32,-0.03,-0.408%,1739698050.00,United States,2021,3475110,Health Care,Biotechnology: Biological Products (No Diagnostic Substances)
RXST,RxSight Inc. Common Stock,$56.95,-0.04,-0.07%,2118331506.00,United States,2021,246763,Health Care,Ophthalmic Goods
RXT,Rackspace Technology Inc. Common Stock,$2.79,-0.16,-5.424%,624543026.00,United States,2020,1187850,Technology,Computer Software: Programming Data Processing
RYAAY,Ryanair Holdings plc American Depositary Shares,$118.63,0.78,0.662%,135215722937.00,Ireland,1997,799432,Consumer Discretionary,Air Freight/Delivery Services
RYTM,Rhythm Pharmaceuticals Inc. Common Stock,$42.28,1.47,3.602%,2577934593.00,United States,2017,307523,Health Care,Biotechnology: Pharmaceutical Preparations
RZLT,Rezolute Inc. Common Stock (NV),$4.13,-0.04,-0.959%,165758157.00,United States,,184224,Health Care,Biotechnology: Pharmaceutical Preparations
SABR,Sabre Corporation Common Stock,$2.77,0.07,2.593%,1057952651.00,United States,2014,2473311,Technology,Computer Software: Programming Data Processing
SABS,SAB Biotherapeutics Inc. Common Stock,$2.87,-0.06,-2.048%,26488016.00,United States,2021,1965,Health Care,Biotechnology: Biological Products (No Diagnostic Substances)
SABSW,SAB Biotherapeutics Inc. Warrant,$0.0596,0.0103,20.892%,550065.00,United States,2021,11066,Health Care,Biotechnology: Biological Products (No Diagnostic Substances)
SAFT,Safety Insurance Group Inc. Common Stock,$74.93,0.08,0.107%,1111703815.00,United States,2002,34885,Finance,Property-Casualty Insurers
SAGE,Sage Therapeutics Inc. Common Stock,$10.78,0.16,1.507%,648762294.00,United States,2014,656449,Health Care,Biotechnology: Pharmaceutical Preparations
SAI,SAI.TECH Global Corporation Class A Ordinary Shares,$0.9375,0.0375,4.167%,13512468.00,Singapore,2021,117601,Technology,EDP Services
SAIA,Saia Inc. Common Stock,$464.23,-5.99,-1.274%,12343022445.00,United States,,221725,Industrials,Trucking Freight/Courier Services
SAIC,Science Applications International Corporation Common Stock,$114.25,-2.07,-1.78%,5853159573.00,United States,,744689,Technology,EDP Services
SAITW,SAI.TECH Global Corporation Warrant,$0.0779,0.00,0.00%,1122796.00,Singapore,2021,1,Technology,EDP Services
SAMG,Silvercrest Asset Management Group Inc. Class A Common Stock,$14.71,-0.58,-3.793%,204989734.00,United States,2013,40053,Finance,Investment Managers
SANA,Sana Biotechnology Inc. Common Stock,$5.09,-0.13,-2.49%,1127449802.00,United States,2021,996872,Health Care,Biotechnology: Biological Products (No Diagnostic Substances)
SANG,Sangoma Technologies Corporation Common Shares,$4.68,0.00,0.00%,155997818.00,Canada,,86,Technology,Computer Software: Programming Data Processing
SANM,Sanmina Corporation Common Stock,$65.03,-1.21,-1.827%,3606147478.00,United States,1993,172448,Technology,Electrical Products
SANW,S&W Seed Company Common Stock (NV),$0.2849,-0.0193,-6.345%,12348676.00,United States,,71313,Consumer Staples,Farming/Seeds/Milling
SASR,Sandy Spring Bancorp Inc. Common Stock,$23.54,-0.56,-2.324%,1060744250.00,United States,,221188,Finance,Major Banks
SATL,Satellogic Inc. Class A Ordinary Shares,$1.04,0.03,2.97%,93916144.00,Uruguay,,23731,Technology,Radio And Television Broadcasting And Communications Equipment
SATLW,Satellogic Inc. Warrant,$0.054,0.004,8.00%,4876415.00,Uruguay,,16254,Technology,Radio And Television Broadcasting And Communications Equipment
SATS,EchoStar  Corporation Common Stock,$18.53,0.14,0.761%,5031310906.00,United States,,761431,Consumer Discretionary,Telecommunications Equipment
SAVA,Cassava Sciences Inc. Common Stock,$10.215,-0.555,-5.153%,490076536.00,United States,,2672798,Health Care,Biotechnology: Pharmaceutical Preparations
SBAC,SBA Communications Corporation Class A Common Stock,$190.83,-1.35,-0.702%,20503350362.00,United States,1999,666436,Real Estate,Real Estate Investment Trusts
SBCF,Seacoast Banking Corporation of Florida Common Stock,$23.00,-0.25,-1.075%,1953506242.00,United States,,263649,Finance,Major Banks
SBET,SharpLink Gaming Inc. Common Stock,$0.46,-0.0301,-6.142%,1317318.00,Israel,,21464,Technology,Computer Software: Prepackaged Software
SBFG,SB Financial Group Inc. Common Stock,$14.13,0.00,0.00%,95571039.00,United States,,340,Finance,Major Banks
SBFM,Sunshine Biopharma Inc. Common Stock,$0.343,0.0253,7.963%,6498153.00,Canada,,1623397,Health Care,Biotechnology: Pharmaceutical Preparations
SBFMW,Sunshine Biopharma Inc. Warrant,$0.10,0.0146,17.096%,1894505.00,Canada,,3507,Health Care,Biotechnology: Pharmaceutical Preparations
SBGI,Sinclair Inc. Class A Common Stock,$13.38,0.03,0.225%,567348447.00,United States,1995,456344,Industrials,Broadcasting
SBLK,Star Bulk Carriers Corp. Common Shares,$24.21,-0.79,-3.16%,2034048955.00,Greece,,1224138,Consumer Discretionary,Marine Transportation
SBRA,Sabra Health Care REIT Inc. Common Stock,$15.39,0.03,0.195%,3562716822.00,United States,,1501987,Real Estate,Real Estate Investment Trusts
SBSI,Southside Bancshares Inc. Common Stock,$26.40,-0.33,-1.235%,799516397.00,United States,,72863,Finance,Major Banks
SBT,Sterling Bancorp Inc. Common Stock,$5.10,-0.07,-1.354%,265332539.00,United States,2017,9142,Finance,Savings Institutions
SBUX,Starbucks Corporation Common Stock,$76.05,-0.21,-0.275%,86141835000.00,United States,1992,9660752,Consumer Discretionary,Restaurants
SCHL,Scholastic Corporation Common Stock,$34.85,-0.10,-0.286%,996907669.00,United States,1992,114177,Consumer Discretionary,Books
SCKT,Socket Mobile Inc. Common Stock,$1.08,-0.0201,-1.827%,8150693.00,United States,,3439,Technology,Computer Manufacturing
SCLX,Scilex Holding Company Common Stock,$1.88,0.08,4.444%,340637078.00,United States,2021,1389010,Health Care,Biotechnology: Biological Products (No Diagnostic Substances)
SCLXW,Scilex Holding Company Warrant,$0.4804,0.0315,7.017%,87043645.00,United States,2021,38118,Health Care,Biotechnology: Biological Products (No Diagnostic Substances)
SCNI,Scinai Immunotherapeutics Ltd. American Depositary Shares,$3.07,-0.055,-1.76%,1425380.00,Israel,2015,44102,Health Care,Biotechnology: Biological Products (No Diagnostic Substances)
SCOR,comScore Inc. Common Stock,$12.68,-0.47,-3.574%,61292838.00,United States,2018,5860,Consumer Discretionary,Business Services
SCPH,scPharmaceuticals Inc. Common Stock,$4.41,0.16,3.765%,158999944.00,United States,2017,144523,Health Care,Biotechnology: Pharmaceutical Preparations
SCSC,ScanSource Inc. Common Stock,$41.93,-1.82,-4.16%,1036056924.00,United States,,173494,Technology,Retail: Computer Software & Peripheral Equipment
SCVL,Shoe Carnival Inc. Common Stock,$35.77,-0.64,-1.758%,971453178.00,United States,1993,187251,Consumer Discretionary,Clothing/Shoe/Accessory Stores
SCWO,374Water Inc. Common Stock,$1.15,0.07,6.481%,152571013.00,United States,,128805,Consumer Discretionary,Metal Fabrications
SCWX,SecureWorks Corp. Class A Common Stock,$6.97,-0.33,-4.521%,616168227.00,United States,2016,20628,Technology,Computer Software: Prepackaged Software
SCYX,SCYNEXIS Inc. Common Stock,$1.87,-0.07,-3.608%,70648219.00,United States,2014,153373,Health Care,Biotechnology: Pharmaceutical Preparations
SDA,SunCar Technology Group Inc. Class A Ordinary Shares,$9.09,-0.11,-1.196%,815418977.00,Hong Kong,2021,205639,Consumer Discretionary,Automotive Aftermarket
SDAWW,SunCar Technology Group Inc. Warrant,$0.1525,0.00,0.00%,13680021.00,Hong Kong,2021,18,Consumer Discretionary,Automotive Aftermarket
SDGR,Schrodinger Inc. Common Stock,$20.71,0.61,3.035%,1505190167.00,United States,2020,420730,Health Care,Biotechnology: Pharmaceutical Preparations
SDIG,Stronghold Digital Mining Inc. Class A Common Stock,$3.95,-0.23,-5.502%,60716050.00,United States,2021,537611,Technology,EDP Services
SDOT,Sadot Group Inc. Common Stock,$0.4291,-0.0218,-4.835%,23484197.00,United States,2020,82128,Consumer Discretionary,Restaurants
SEAT,Vivid Seats Inc. Class A Common Stock,$5.34,-0.03,-0.559%,1108859336.00,United States,,634660,Consumer Discretionary,Services-Misc. Amusement & Recreation
SEATW,Vivid Seats Inc. Warrant,$0.7487,0.0962,14.743%,155468724.00,United States,,1403,Consumer Discretionary,Services-Misc. Amusement & Recreation
SEDG,SolarEdge Technologies Inc. Common Stock,$25.05,-0.27,-1.066%,1435350070.00,Israel,2015,3261088,Technology,Semiconductors
SEED,Origin Agritech Limited Common Stock,$4.88,0.17,3.609%,30914790.00,China,,11687,Consumer Staples,Farming/Seeds/Milling
SEEL,Seelos Therapeutics Inc. Common Stock,$0.555,-0.01,-1.77%,1206059.00,United States,,81730,Health Care,Biotechnology: Pharmaceutical Preparations
SEER,Seer Inc. Class A Common Stock,$1.62,-0.02,-1.22%,105197422.00,United States,2020,339627,Industrials,Biotechnology: Laboratory Analytical Instruments
SEIC,SEI Investments Company Common Stock,$65.02,-0.62,-0.945%,8542876824.00,United States,1981,494292,Finance,Investment Bankers/Brokers/Service
SELF,Global Self Storage Inc. Common Stock,$5.01,0.1262,2.584%,56411949.00,United States,,27765,Real Estate,Real Estate Investment Trusts
SELX,Semilux International Ltd. Ordinary Shares,$1.79,-0.01,-0.556%,66996754.00,Taiwan,,19742,Technology,Semiconductors
SENEA,Seneca Foods Corp. Class A Common Stock,$59.83,-0.04,-0.067%,416682206.00,United States,,51778,Consumer Staples,Packaged Foods
SENEB,Seneca Foods Corp. Class B Common Stock,$58.40,0.00,0.00%,406723062.00,United States,,199,Consumer Staples,Packaged Foods
SEPA,SEP Acquisition Corp Class A Common Stock,$10.44,-0.09,-0.855%,0.00,United States,2021,10797,Finance,Blank Checks
SEPAW,SEP Acquisition Corp Warrants,$0.004,0.00,0.00%,0.00,United States,2021,2,Finance,Blank Checks
SERA,Sera Prognostics Inc. Class A Common Stock,$5.39,0.01,0.186%,176003858.00,United States,2021,89158,Health Care,Medical Specialities
SERV,Serve Robotics Inc. Common Stock,$2.43,0.33,15.714%,90106142.00,United States,,1796872,Consumer Discretionary,Industrial Specialties
SEVN,Seven Hills Realty Trust Common Stock,$12.70,-0.10,-0.781%,188029774.00,United States,,94851,Real Estate,Real Estate Investment Trusts
SEZL,Sezzle Inc. Common Stock,$89.93,-0.27,-0.299%,509668293.00,United States,,120891,Consumer Discretionary,Business Services
SFBC,Sound Financial Bancorp Inc. Common Stock,$42.05,0.00,0.00%,107542244.00,United States,,10,Finance,Savings Institutions
SFIX,Stitch Fix Inc. Class A Common Stock,$4.17,0.29,7.474%,510160761.00,United States,2017,2953764,Consumer Discretionary,Catalog/Specialty Distribution
SFM,Sprouts Farmers Market Inc. Common Stock,$82.51,-0.13,-0.157%,8290378970.00,United States,2013,1186897,Consumer Staples,Food Chains
