Symbol,Name,Last Sale,Net Change,% Change,Market Cap,Country,IPO Year,Volume,Sector,Industry
VNET,VNET Group Inc. American Depositary Shares,$2.24,-0.03,-1.322%,576550242.00,China,2011,286463,Technology,Computer Software: Programming Data Processing
VNOM,Viper Energy Inc. Class A Common Stock,$38.99,-0.57,-1.441%,6895587484.00,United States,2014,1495510,Energy,Oil & Gas Production
VOD,Vodafone Group Plc American Depositary Shares,$8.98,0.14,1.584%,24096186561.00,United Kingdom,,4139792,Telecommunications,Telecommunications Equipment
VOR,Vor Biopharma Inc. Common Stock,$0.908,-0.012,-1.304%,61979719.00,United States,2021,209312,Health Care,Biotechnology: Biological Products (No Diagnostic Substances)
VOXR,Vox Royalty Corp. Common Stock,$2.705,0.045,1.692%,135645852.00,Canada,,138245,Basic Materials,Precious Metals
VOXX,VOXX International Corporation Class A Common Stock,$2.78,-0.09,-3.136%,62667030.00,United States,,61742,Technology,Electronic Components
VRA,Vera Bradley Inc. Common Stock,$5.79,-0.01,-0.172%,170734281.00,United States,2010,583908,Consumer Discretionary,Apparel
VRAR,The Glimpse Group Inc. Common Stock,$1.00,0.00,0.00%,18148217.00,United States,2021,19620,Technology,EDP Services
VRAX,Virax Biolabs Group Limited Ordinary Shares,$1.22,0.12,10.909%,1897100.00,United Kingdom,2022,132214,Health Care,Biotechnology: In Vitro & In Vivo Diagnostic Substances
VRCA,Verrica Pharmaceuticals Inc. Common Stock,$7.63,0.13,1.733%,323665004.00,United States,2018,86404,Health Care,Biotechnology: Pharmaceutical Preparations
VRDN,Viridian Therapeutics Inc. Common Stock,$12.32,0.07,0.571%,786292806.00,United States,2014,555634,Health Care,Medical Specialities
VREX,Varex Imaging Corporation Common Stock,$14.35,-0.01,-0.07%,586915000.00,United States,,355985,Technology,Industrial Machinery/Components
VRM,Vroom Inc. Common Stock,$9.27,-0.19,-2.008%,16771905.00,United States,2020,12892,Consumer Discretionary,Retail-Auto Dealers and Gas Stations
VRME,VerifyMe Inc. Common Stock,$1.38,0.04,2.985%,14043712.00,United States,,14529,Technology,EDP Services
VRMEW,VerifyMe Inc. Warrant,$0.0404,-0.0345,-46.061%,411135.00,United States,,1152,Technology,EDP Services
VRNA,Verona Pharma plc American Depositary Share,$16.11,0.40,2.546%,1306227347.00,United Kingdom,2017,1352150,Health Care,Biotechnology: Pharmaceutical Preparations
VRNS,Varonis Systems Inc. Common Stock,$48.33,0.33,0.688%,5388950139.00,United States,2014,606322,Technology,Computer Software: Prepackaged Software
VRNT,Verint Systems Inc. Common Stock,$31.32,-0.67,-2.094%,1934845806.00,United States,2010,421276,Technology,EDP Services
VRPX,Virpax Pharmaceuticals Inc. Common Stock,$0.578,0.047,8.851%,676973.00,United States,2021,54920,Health Care,Biotechnology: Pharmaceutical Preparations
VRRM,Verra Mobility Corporation Class A Common Stock,$27.59,0.23,0.841%,4594418570.00,United States,2017,662147,Consumer Discretionary,Transportation Services
VRSK,Verisk Analytics Inc. Common Stock,$274.45,1.17,0.428%,39157218795.00,United States,2009,592336,Technology,EDP Services
VRSN,VeriSign Inc. Common Stock,$176.80,1.35,0.769%,17609280000.00,United States,1998,468289,Technology,EDP Services
VRTX,Vertex Pharmaceuticals Incorporated Common Stock,$474.57,4.29,0.912%,122464395869.00,United States,1991,848791,Health Care,Biotechnology: Pharmaceutical Preparations
VS,Versus Systems Inc. Common Shares,$1.97,-0.11,-5.288%,4936850.00,Canada,,1008636,Technology,EDP Services
VSAC,Vision Sensing Acquisition Corp. Class A Common Stock,$11.60,0.00,0.00%,0.00,United States,2021,1,Finance,Blank Checks
VSAT,ViaSat Inc. Common Stock,$14.39,-0.10,-0.69%,1811138711.00,United States,1996,1597693,Technology,Radio And Television Broadcasting And Communications Equipment
VSEC,VSE Corporation Common Stock,$89.30,1.10,1.247%,1427264576.00,United States,,149722,Consumer Discretionary,Military/Government/Technical
VSEE,VSee Health Inc. Common Stock,$8.86,-1.64,-15.619%,31931139.00,United States,2021,78056,,
VSEEW,VSee Health Inc. Warrant,$0.225,0.00,0.00%,810892.00,United States,2021,20740,,
VSME,VS Media Holdings Limited Class A Ordinary Shares,$2.06,-0.04,-1.905%,6701475.00,China,2023,94847,Consumer Discretionary,Publishing
VSSYW,Versus Systems Inc. Class A Warrants,$0.0911,-0.0088,-8.809%,228298.00,Canada,,6348,Technology,EDP Services
VSTA,Vasta Platform Limited Class A Ordinary Shares,$3.15,0.07,2.273%,255157040.00,Brazil,2020,3015,Real Estate,Other Consumer Services
VSTE,Vast Renewables Limited Ordinary Shares,$2.37,0.1199,5.329%,69421765.00,Australia,,5409,Industrials,Building Products
VSTM,Verastem Inc. Common Stock,$2.74,-0.20,-6.803%,69392010.00,United States,2012,690165,Health Care,Biotechnology: Pharmaceutical Preparations
VTGN,Vistagen Therapeutics Inc. Common Stock,$3.40,0.09,2.719%,91885711.00,United States,,82329,Health Care,Biotechnology: Pharmaceutical Preparations
VTNR,Vertex Energy Inc Common Stock,$0.6965,0.0255,3.80%,65132742.00,United States,,2601077,Energy,Integrated oil Companies
VTRS,Viatris Inc. Common Stock,$10.32,-0.06,-0.578%,12287774452.00,United States,,17697451,Health Care,Biotechnology: Pharmaceutical Preparations
VTSI,VirTra Inc. Common Stock,$7.65,-0.10,-1.29%,84989435.00,United States,,145036,Consumer Discretionary,Miscellaneous manufacturing industries
VTVT,vTv Therapeutics Inc. Class A Common Stock,$17.58,-0.70,-3.829%,52919421.00,United States,2015,9724,Health Care,Biotechnology: Pharmaceutical Preparations
VTYX,Ventyx Biosciences Inc. Common Stock,$2.18,-0.04,-1.802%,153688544.00,United States,2021,553911,Health Care,Biotechnology: Pharmaceutical Preparations
VUZI,Vuzix Corporation Common Stock,$1.21,-0.04,-3.20%,78318571.00,United States,,302586,Technology,Radio And Television Broadcasting And Communications Equipment
VVOS,Vivos Therapeutics Inc. Common Stock,$2.30,-0.105,-4.366%,7422721.00,United States,2020,22027,Health Care,Medical/Dental Instruments
VVPR,VivoPower International PLC Ordinary Shares,$2.48,-0.02,-0.80%,6395488.00,United Kingdom,,2077557,Utilities,Power Generation
VWE,Vintage Wine Estates Inc. Common Stock,$0.1502,0.0132,9.635%,9003363.00,United States,,3935258,Consumer Staples,Beverages (Production/Distribution)
VWEWW,Vintage Wine Estates Inc. Warrants,$0.0095,0.0002,2.151%,586065.00,United States,,46235,Consumer Staples,Beverages (Production/Distribution)
VXRT,Vaxart Inc Common Stock,$0.6583,0.013,2.015%,116412463.00,United States,,954601,Health Care,Biotechnology: Biological Products (No Diagnostic Substances)
VYGR,Voyager Therapeutics Inc. Common Stock,$7.52,-0.21,-2.717%,409040083.00,United States,2015,479685,Health Care,Biotechnology: Biological Products (No Diagnostic Substances)
VYNE,VYNE Therapeutics Inc. Common Stock,$1.84,0.01,0.546%,26731974.00,United States,2018,16813,Health Care,Biotechnology: Pharmaceutical Preparations
WABC,Westamerica Bancorporation Common Stock,$47.62,-0.55,-1.142%,1270425456.00,United States,,63600,Finance,Major Banks
WAFD,WaFd Inc. Common Stock,$27.90,-0.30,-1.064%,2271473841.00,United States,,252669,Finance,Major Banks
WAFDP,WaFd Inc. Depositary Shares,$15.04,0.08,0.535%,1224479088.00,United States,,16546,Finance,Major Banks
WAFU,Wah Fu Education Group Limited Ordinary Shares,$1.96,-0.02,-1.01%,8644696.00,China,2019,7081,Real Estate,Other Consumer Services
WALD,Waldencast plc Class A Ordinary Share,$3.50,-0.06,-1.685%,427661997.00,United States,2021,86590,Consumer Discretionary,Package Goods/Cosmetics
WASH,Washington Trust Bancorp Inc. Common Stock,$25.83,-0.57,-2.159%,440514274.00,United States,,79851,Finance,Major Banks
WATT,Energous Corporation Common Stock,$1.08,-0.02,-1.818%,7061299.00,United States,2014,17198,Technology,Radio And Television Broadcasting And Communications Equipment
WAVD,WaveDancer Inc. Common Stock,$1.83,0.00,0.00%,3684119.00,United States,,431,Technology,Computer Software: Prepackaged Software
WAVE,Eco Wave Power Global AB (publ) American Depositary Shares,$2.69,-0.0319,-1.172%,119422130.00,Israel,2021,3856,Utilities,Electric Utilities: Central
WAVS,Western Acquisition Ventures Corp. Common Stock,$11.08,0.00,0.00%,0.00,United States,2022,5,Technology,EDP Services
WAY,Waystar Holding Corp. Common Stock,$21.52,0.02,0.093%,3586515324.00,United States,2024,1316217,Technology,EDP Services
WB,Weibo Corporation American Depositary Share,$8.22,-0.10,-1.202%,1994261943.00,China,2014,877760,Technology,Computer Software: Programming Data Processing
WBA,Walgreens Boots Alliance Inc. Common Stock,$11.26,0.16,1.441%,9720476917.00,United States,,29729927,Consumer Staples,Retail-Drug Stores and Proprietary Stores
WBD,Warner Bros. Discovery Inc. Series A Common Stock ,$7.21,-0.02,-0.277%,17666759600.00,United States,,29110771,Telecommunications,Cable & Other Pay Television Services
WBTN,WEBTOON Entertainment Inc. Common stock,$19.65,-0.66,-3.25%,0.00,United States,2024,649856,Consumer Discretionary,Publishing
WBUY,WEBUY GLOBAL LTD. Ordinary Shares,$0.169,0.0024,1.441%,8852490.00,Singapore,2023,360720,Consumer Discretionary,Other Specialty Stores
WDAY,Workday Inc. Class A Common Stock,$229.13,3.58,1.587%,60719450000.00,United States,,1692709,Technology,EDP Services
WDC,Western Digital Corporation Common Stock,$77.17,-0.62,-0.797%,25197908630.00,United States,,2313882,Technology,Electronic Components
WDFC,WD-40 Company Common Stock,$214.02,0.57,0.267%,2900535371.00,United States,1973,57108,Industrials,Major Chemicals
WEN,Wendy's Company (The) Common Stock,$16.26,-0.02,-0.123%,3335470564.00,United States,,4064890,Consumer Discretionary,Restaurants
WENA,ANEW MEDICAL INC. Common Stock,$1.50,-0.32,-17.582%,22695590.00,United States,2022,386593,Finance,Blank Checks
WENAW,ANEW MEDICAL INC. Warrant ,$0.0596,-0.0016,-2.614%,901771.00,United States,2022,174390,Finance,Blank Checks
WERN,Werner Enterprises Inc. Common Stock,$35.23,-0.62,-1.729%,2234034107.00,United States,1986,426912,Industrials,Trucking Freight/Courier Services
WEST,Westrock Coffee Company Common Stock,$10.00,-0.06,-0.596%,895316510.00,United States,,107986,Consumer Staples,Beverages (Production/Distribution)
WESTW,Westrock Coffee Company Warrants,$2.13,0.04,1.914%,190702417.00,United States,,862,Consumer Staples,Beverages (Production/Distribution)
WETH,Wetouch Technology Inc. Common Stock,$3.16,-0.04,-1.25%,37703647.00,China,,87401,Technology,Computer peripheral equipment
WEYS,Weyco Group Inc. Common Stock,$28.13,-0.65,-2.259%,267231990.00,United States,,27696,Consumer Staples,Apparel
WFCF,Where Food Comes From Inc. Common Stock,$9.88,-0.12,-1.20%,53112578.00,United States,,3871,Technology,Computer Software: Prepackaged Software
WFRD,Weatherford International plc Ordinary Shares,$121.78,-3.75,-2.987%,8908711169.00,United States,,710631,Industrials,Metal Fabrications
WGS,GeneDx Holdings Corp. Class A Common Stock,$28.91,0.91,3.25%,755756576.00,United States,2020,267071,Technology,Retail: Computer Software & Peripheral Equipment
WGSWW,GeneDx Holdings Corp. Warrant,$0.029,-0.004,-12.121%,758109.00,United States,2020,33923,Technology,Retail: Computer Software & Peripheral Equipment
WHF,WhiteHorse Finance Inc. Common Stock,$12.32,-0.30,-2.377%,286354844.00,United States,,55422,Finance,Finance Companies
WHFCL,WhiteHorse Finance Inc. 7.875% Notes due 2028,$25.2299,0.0299,0.119%,586420786.00,United States,,2344,,
WHLM,Wilhelmina International Inc. Common Stock,$5.65,0.33,6.203%,29138994.00,United States,,8081,Consumer Discretionary,Professional Services
WHLR,Wheeler Real Estate Investment Trust Inc. Common Stock,$15.33,-4.18,-21.425%,1448302.00,United States,2012,30326,Real Estate,Real Estate Investment Trusts
WHLRD,Wheeler Real Estate Investment Trust Inc. Series D Cumulative Preferred Stock,$19.89,-0.1199,-0.599%,1879108.00,United States,,2872,Real Estate,Real Estate Investment Trusts
WHLRP,Wheeler Real Estate Investment Trust Inc. Class B Preferred Stock,$2.23,0.025,1.134%,210679.00,United States,,4215,Real Estate,Real Estate Investment Trusts
WILC,G. Willi-Food International  Ltd. Ordinary Shares,$8.93,-0.0098,-0.11%,123832462.00,Israel,,1584,Consumer Discretionary,Food Distributors
WIMI,WiMi Hologram Cloud Inc. American Depositary Share,$0.868,-0.035,-3.876%,85244580.00,China,2020,522780,Technology,Computer Software: Prepackaged Software
WINA,Winmark Corporation Common Stock,$349.15,-3.52,-0.998%,1221127685.00,United States,,40480,Consumer Discretionary,Other Specialty Stores
WING,Wingstop Inc. Common Stock,$418.72,0.23,0.055%,12297797188.00,United States,2015,299186,Consumer Discretionary,Restaurants
WINT,Windtree Therapeutics Inc. Common Stock,$3.18,-0.01,-0.313%,1882271.00,United States,,2535,Health Care,Biotechnology: Biological Products (No Diagnostic Substances)
WINV,WinVest Acquisition Corp. Common Stock,$11.95,0.00,0.00%,0.00,United States,2021,82,Finance,Blank Checks
WINVU,WinVest Acquisition Corp. Unit,$12.83,0.5799,4.734%,0.00,United States,2021,9296,Finance,Blank Checks
WINVW,WinVest Acquisition Corp. Warrant,$0.0137,0.00,0.00%,0.00,United States,2021,170,Finance,Blank Checks
WISA,WiSA Technologies Inc. Common Stock,$3.20,0.44,15.942%,14929789.00,United States,2018,613309,Technology,Semiconductors
WIX,Wix.com Ltd. Ordinary Shares,$154.21,-1.89,-1.211%,8816585875.00,Israel,2013,466069,Technology,Computer Software: Programming Data Processing
WKEY,WISeKey International Holding Ltd American Depositary Shares,$2.23,0.021,0.951%,20315197.00,Switzerland,,5824,Technology,EDP Services
WKHS,Workhorse Group Inc. Common Stock,$1.34,-0.02,-1.471%,25140354.00,United States,,967112,Consumer Discretionary,Auto Manufacturing
WKME,WalkMe Ltd. Ordinary Shares,$13.91,0.01,0.072%,1263927448.00,Israel,2021,123097,Technology,Computer Software: Prepackaged Software
WKSP,Worksport Ltd. Common Stock,$0.7256,-0.1343,-15.618%,18571712.00,Canada,,1128807,Consumer Discretionary,Auto Parts:O.E.M.
WKSPW,Worksport Ltd. Warrant,$0.11,0.0041,3.872%,2815447.00,Canada,,54779,Consumer Discretionary,Auto Parts:O.E.M.
WLDN,Willdan Group Inc. Common Stock,$29.53,0.16,0.545%,408018195.00,United States,2006,74690,Consumer Discretionary,Military/Government/Technical
WLDS,Wearable Devices Ltd. Ordinary Share,$0.5293,0.0592,12.593%,10791066.00,Israel,2022,308186,Telecommunications,Computer Communications Equipment
WLDSW,Wearable Devices Ltd. Warrant,$0.055,0.00,0.00%,1121309.00,Israel,2022,944,Telecommunications,Computer Communications Equipment
WLFC,Willis Lease Finance Corporation Common Stock,$66.80,-2.50,-3.608%,439043735.00,United States,1996,24811,Consumer Discretionary,Industrial Specialties
WLGS,Wang & Lee Group Inc. Ordinary Shares,$0.5712,0.0072,1.277%,8621605.00,Hong Kong,2023,50993,Consumer Discretionary,Engineering & Construction
WMG,Warner Music Group Corp. Class A Common Stock,$30.33,-0.30,-0.979%,15708316455.00,United States,2020,1329709,Consumer Discretionary,Services-Misc. Amusement & Recreation
WMPN,William Penn Bancorporation Common Stock,$11.46,0.10,0.88%,108132022.00,United States,2021,5633,Finance,Banks
WNEB,Western New England Bancorp Inc. Common Stock,$6.70,-0.05,-0.741%,144905523.00,United States,,41432,Finance,Savings Institutions
WNW,Meiwu Technology Company Limited Ordinary Shares,$0.7775,-0.0675,-7.988%,1353857.00,China,2020,93904,Consumer Discretionary,Catalog/Specialty Distribution
WOOF,Petco Health and Wellness Company Inc. Class A Common Stock,$3.48,0.31,9.779%,1081523813.00,United States,2021,4176619,Consumer Discretionary,Other Specialty Stores
WORX,SCWorx Corp. Common Stock,$1.59,-0.01,-0.625%,1925546.00,United States,2016,960,Consumer Discretionary,Services-Misc. Amusement & Recreation
WPRT,Westport Fuel Systems Inc Common Shares,$5.86,0.20,3.534%,100991006.00,Canada,2008,31453,Industrials,Industrial Machinery/Components
WRAP,Wrap Technologies Inc. Common Stock,$1.79,-0.03,-1.648%,79143363.00,United States,,91524,Industrials,Ordnance And Accessories
WRLD,World Acceptance Corporation Common Stock,$123.76,-2.32,-1.84%,723364576.00,United States,1991,24003,Finance,Finance: Consumer Services
WRNT,Warrantee Inc. American Depositary Shares,$0.312,-0.001,-0.319%,6990048.00,Japan,2023,7997,Consumer Discretionary,Other Consumer Services
WSBC,WesBanco Inc. Common Stock,$27.11,-0.45,-1.633%,1610962871.00,United States,,130216,Finance,Major Banks
WSBCP,WesBanco Inc. Depositary Shares Each Representing a 1/40th Interest in a Share of 6.75% Fixed-Rate Reset Non-Cumulative Perpetual Preferred Stock Series A,$24.61,-0.0667,-0.27%,1462404878.00,United States,,1605,Finance,Major Banks
WSBF,Waterstone Financial Inc. Common Stock (MD),$12.96,-0.01,-0.077%,254582883.00,United States,2005,52672,Finance,Savings Institutions
WSC,WillScot Mobile Mini Holdings Corp. Class A Common Stock,$35.84,-1.67,-4.452%,6816072955.00,United States,2015,2940579,Industrials,Misc Corporate Leasing Services
WSFS,WSFS Financial Corporation Common Stock,$46.10,-0.38,-0.818%,2770321460.00,United States,,140897,Finance,Major Banks
WTBA,West Bancorporation Common Stock,$16.61,-0.67,-3.877%,279279743.00,United States,,33363,Finance,Major Banks
WTFC,Wintrust Financial Corporation Common Stock,$96.43,-1.67,-1.702%,5954894923.00,United States,,739039,Finance,Major Banks
WTFCM,Wintrust Financial Corporation Fixed-to-Floating Rate Non-Cumulative Perpetual Preferred Stock Series D,$24.41,0.01,0.041%,1507404180.00,United States,,4795,Finance,Major Banks
WTFCP,Wintrust Financial Corporation Depositary Shares Each Representing a 1/1000th Interest in a Share of 6.875% Fixed-Rate Reset Non-Cumulative Perpetual Preferred Stock Series E,$24.65,-0.05,-0.202%,1522225032.00,United States,,12391,Finance,Major Banks
WTMA,Welsbach Technology Metals Acquisition Corp. Common Stock,$11.10,0.01,0.09%,0.00,United States,2022,864,Miscellaneous,Industrial Machinery/Components
WTMAR,Welsbach Technology Metals Acquisition Corp. one right to receive 1/10th of a share of common stock,$0.1198,0.00,0.00%,0.00,United States,2022,99,Miscellaneous,Industrial Machinery/Components
WTO,UTime Limited Ordinary Shares,$0.814,0.0041,0.506%,11044184.00,China,2021,124548,Technology,Consumer Electronics/Appliances
WTW,Willis Towers Watson Public Limited Company Ordinary Shares,$261.61,1.27,0.488%,26745950280.00,United Kingdom,2001,373605,Finance,Specialty Insurers
WULF,TeraWulf Inc. Common Stock,$5.58,0.37,7.102%,1859155716.00,United States,,25125544,Technology,EDP Services
WVE,Wave Life Sciences Ltd. Ordinary Shares,$5.47,0.15,2.82%,669857075.00,Singapore,2015,384052,Health Care,Biotechnology: Pharmaceutical Preparations
WVVI,Willamette Valley Vineyards Inc. Common Stock,$4.05,0.19,4.922%,20106342.00,United States,,1330,Consumer Staples,Beverages (Production/Distribution)
WVVIP,Willamette Valley Vineyards Inc. Series A Redeemable Preferred Stock,$3.80,-0.035,-0.913%,18865210.00,United States,,1773,Consumer Staples,Beverages (Production/Distribution)
WW,WW International Inc. Common Stock,$1.28,0.14,12.281%,101471580.00,United States,,3073335,Consumer Discretionary,Other Consumer Services
WWD,Woodward Inc. Common Stock,$172.10,-1.98,-1.137%,10484305325.00,United States,,300823,Energy,Industrial Machinery/Components
WYNN,Wynn Resorts Limited Common stock,$86.83,-0.45,-0.516%,9731112861.00,United States,2002,1924002,Consumer Discretionary,Hotels/Resorts
XAIR,Beyond Air Inc. Common Stock,$0.59,-0.0008,-0.135%,27081484.00,United States,,428509,Health Care,Medical/Dental Instruments
XBIO,Xenetic Biosciences Inc. Common Stock,$4.01,0.2664,7.116%,6178143.00,United States,,2664,Health Care,Biotechnology: Pharmaceutical Preparations
XBIOW,Xenetic Biosciences Inc. Warrants,$16.50,2.46,17.521%,25421286.00,United States,,1988,Health Care,Biotechnology: Pharmaceutical Preparations
XBIT,XBiotech Inc. Common Stock,$5.70,-0.09,-1.554%,173607927.00,United States,2015,76024,Health Care,Biotechnology: Pharmaceutical Preparations
XBP,XBP Europe Holdings Inc. Common Stock,$1.50,-0.07,-4.459%,45249153.00,United States,2021,60784,Consumer Discretionary,Business Services
XBPEW,XBP Europe Holdings Inc. Warrant,$0.05,0.00,0.00%,1508305.00,United States,2021,5374,Consumer Discretionary,Business Services
XCUR,Exicure Inc. Common Stock,$0.3013,-0.0139,-4.41%,2606591.00,United States,,38361,Health Care,Biotechnology: Pharmaceutical Preparations
XEL,Xcel Energy Inc. Common Stock,$52.69,-0.06,-0.114%,29276642041.00,United States,,1653017,Utilities,Power Generation
XELA,Exela Technologies Inc. Common Stock,$2.34,-0.01,-0.426%,14894921.00,United States,2015,57971,Consumer Discretionary,Business Services
XELAP,Exela Technologies Inc. 6.00% Series B Cumulative Convertible Perpetual Preferred Stock,$1.99,0.09,4.737%,12667048.00,United States,,1214,Consumer Discretionary,Business Services
XELB,Xcel Brands Inc. Common Stock,$0.61,-0.03,-4.688%,14330191.00,United States,,7028,Miscellaneous,Multi-Sector Companies
XENE,Xenon Pharmaceuticals Inc. Common Shares,$36.81,0.69,1.91%,2778009583.00,Canada,2014,347498,Health Care,Biotechnology: Pharmaceutical Preparations
XERS,Xeris Biopharma Holdings Inc. Common Stock,$2.11,0.03,1.442%,312819449.00,United States,2018,624204,Health Care,Biotechnology: Pharmaceutical Preparations
XFIN,ExcelFin Acquisition Corp Class A Common Stock,$11.05,0.00,0.00%,0.00,United States,2021,5,Finance,Blank Checks
XFOR,X4 Pharmaceuticals Inc. Common Stock,$0.5489,-0.0156,-2.764%,92181048.00,United States,2017,2182030,Health Care,Biotechnology: Biological Products (No Diagnostic Substances)
XGN,Exagen Inc. Common Stock,$1.74,-0.07,-3.867%,30229859.00,United States,2019,15473,Health Care,Medical Specialities
XHG,XChange TEC.INC American Depositary Shares,$1.13,0.2854,33.791%,5344697.00,China,2019,66198559,Finance,Real Estate
XLO,Xilio Therapeutics Inc. Common Stock,$0.895,0.032,3.708%,33036574.00,United States,2021,82813,Health Care,Biotechnology: Pharmaceutical Preparations
XMTR,Xometry Inc. Class A Common Stock,$11.36,-0.37,-3.154%,523963596.00,United States,2021,332261,Consumer Discretionary,Business Services
XNCR,Xencor Inc. Common Stock,$18.23,-0.38,-2.042%,1124108287.00,United States,2013,274239,Health Care,Biotechnology: Pharmaceutical Preparations
XNET,Xunlei Limited American Depositary Shares,$1.75,0.04,2.339%,113233944.00,China,2014,46460,Technology,Computer Software: Prepackaged Software
XOMA,XOMA Corporation Common Stock,$25.63,-0.27,-1.042%,298296113.00,United States,1986,20169,Health Care,Biotechnology: Pharmaceutical Preparations
XOMAO,XOMA Corporation Depositary Shares Rep Series B 8.375% Cumulative Preferred Stock,$24.908,-0.042,-0.168%,289893078.00,United States,,3850,Health Care,Biotechnology: Pharmaceutical Preparations
XOMAP,XOMA Corporation 8.625% Series A Cumulative Perpetual Preferred Stock,$25.89,-0.45,-1.708%,301322137.00,United States,,1294,Health Care,Biotechnology: Pharmaceutical Preparations
XOS,Xos Inc. Common Stock,$6.71,-0.10,-1.468%,52830272.00,United States,2020,7808,Consumer Discretionary,Auto Parts:O.E.M.
XOSWW,Xos Inc. Warrants,$0.033,0.00,0.00%,259821.00,United States,2020,16547,Consumer Discretionary,Auto Parts:O.E.M.
XP,XP Inc. Class A Common Stock,$17.07,0.24,1.426%,9379848480.00,Brazil,2019,7601526,Finance,Investment Bankers/Brokers/Service
XPEL,XPEL Inc. Common Stock,$33.40,0.28,0.845%,922973429.00,United States,,209862,Industrials,Industrial Specialties
XPON,Expion360 Inc. Common Stock,$0.9693,-0.0007,-0.072%,7216691.00,United States,2022,33380,Miscellaneous,Industrial Machinery/Components
XRAY,DENTSPLY SIRONA Inc. Common Stock,$24.56,-0.20,-0.808%,5099406455.00,United States,1987,1688161,Health Care,Medical/Dental Instruments
XRTX,XORTX Therapeutics Inc. Common Stock,$1.76,0.00,0.00%,5110274.00,Canada,,4665,Health Care,Biotechnology: Pharmaceutical Preparations
XRX,Xerox Holdings Corporation Common Stock,$11.31,-0.30,-2.584%,1404684266.00,United States,,2631702,Technology,Computer peripheral equipment
XTIA,XTI Aerospace Inc. Common Stock,$0.375,-0.0051,-1.342%,4319540.00,United States,2014,1469329,Technology,EDP Services
XTKG,X3 Holdings Co. Ltd. Ordinary Shares,$0.523,-0.017,-3.148%,135827321.00,China,2019,283520,Technology,EDP Services
XTLB,XTL Biopharmaceuticals Ltd. American Depositary Shares,$2.30,0.00,0.00%,12532840.00,Israel,,14018,Health Care,Biotechnology: Pharmaceutical Preparations
XWEL,XWELL Inc. Common Stock,$1.675,-0.065,-3.736%,7007254.00,United States,,5629,Consumer Discretionary,Other Consumer Services
XXII,22nd Century Group Inc. Common Stock,$0.6765,-0.038,-5.318%,5609888.00,United States,,112489,Health Care, Medicinal Chemicals and Botanical Products 
XYLO,Xylo Technologies Ltd. American Depositary Shares,$1.80,0.06,3.448%,3358735.00,Israel,,4654,Health Care,Medical/Dental Instruments
YGMZ,MingZhu Logistics Holdings Limited Ordinary Shares,$1.42,0.02,1.429%,6586372.00,China,2020,139778,Consumer Discretionary,Transportation Services
YHGJ,Yunhong Green CTI Ltd. Common Stock,$1.19,-0.0966,-7.508%,24718605.00,United States,,3061,Industrials,Specialty Chemicals
YI,111 Inc. American Depositary Shares,$1.015,-0.015,-1.456%,86949287.00,China,2018,8608,Consumer Staples,Retail-Drug Stores and Proprietary Stores
YIBO,Planet Image International Limited Class A Ordinary Shares,$1.82,0.00,0.00%,95789512.00,China,2024,1187,,
YJ,Yunji Inc. American Depository Shares,$0.695,-0.005,-0.714%,13666331.00,China,2019,2074,Consumer Discretionary,Other Specialty Stores
YMAB,Y-mAbs Therapeutics Inc. Common Stock,$11.40,0.02,0.176%,500262073.00,United States,2018,224656,Health Care,Biotechnology: Pharmaceutical Preparations
YORW,York Water Company (The) Common Stock,$36.85,0.43,1.181%,528598805.00,United States,,79107,Utilities,Water Supply
YOSH,Yoshiharu Global Co. Class A Common Stock,$4.13,0.23,5.897%,5493916.00,United States,2022,3370,Consumer Discretionary,Restaurants
YOTA,Yotta Acquisition Corporation Common Stock,$11.04,0.05,0.455%,0.00,United States,2022,16752,Consumer Staples,Farming/Seeds/Milling
